{"bundle_path":"reports/pool-5c7c81efde24ad9e64f34415ad1f9b3fbe1d8f9e61b99b7f333217b6494aa81a","completed_at":"2026-08-10T18:57:30Z","created_at":"2026-08-10T18:57:11Z","report_id":"pool-5c7c81efde24ad9e64f34415ad1f9b3fbe1d8f9e61b99b7f333217b6494aa81a","report_kind":"pool","schema_version":"1.0","state":"completed"}
